{"$schema":"https://json-schema.org/draft/2020-12/schema","$id":"https://thedailyline.bet/schemas/video/v1/fact-integrity-report.schema.json","title":"FactIntegrityReport","type":"object","additionalProperties":false,"required":["schema_version","report_id","script_id","status","checks","unsupported_claims","missing_required_claims","protected_token_mismatches","expired_fact_refs","validator_release","validated_at","report_digest"],"properties":{"schema_version":{"const":"fact-integrity-report.v1"},"report_id":{"$ref":"common.schema.json#/$defs/Id"},"script_id":{"$ref":"common.schema.json#/$defs/Ref"},"status":{"enum":["PASS","FAIL","REVIEW_REQUIRED"]},"checks":{"type":"array","items":{"$ref":"#/$defs/Check"}},"unsupported_claims":{"$ref":"common.schema.json#/$defs/RefSet"},"missing_required_claims":{"$ref":"common.schema.json#/$defs/RefSet"},"protected_token_mismatches":{"type":"array","items":{"type":"string"}},"expired_fact_refs":{"$ref":"common.schema.json#/$defs/RefSet"},"validator_release":{"$ref":"common.schema.json#/$defs/Ref"},"validated_at":{"$ref":"common.schema.json#/$defs/Timestamp"},"report_digest":{"$ref":"common.schema.json#/$defs/Digest"}},"$defs":{"Check":{"type":"object","additionalProperties":false,"required":["check_id","status","message"],"properties":{"check_id":{"$ref":"common.schema.json#/$defs/Id"},"status":{"enum":["PASS","FAIL","REVIEW_REQUIRED"]},"message":{"type":"string"}}}}}
