{"schema_version":"fact-integrity-report.v1","report_id":"factcheck.mlb.sf-lad.1a","script_id":"script.mlb.sf-lad.1a","status":"PASS","checks":[{"check_id":"traceability","status":"PASS","message":"All factual segments trace to approved sources."},{"check_id":"protected-tokens","status":"PASS","message":"All protected values preserved."}],"unsupported_claims":[],"missing_required_claims":[],"protected_token_mismatches":[],"expired_fact_refs":[],"validator_release":"dlve-fact-validator@vm0","validated_at":"2026-09-08T16:06:00Z","report_digest":"sha256:b16f4875e87552437f28981daf871a87fab2f1ba0a9211e0a66aedf0108aa963"}
